<?xml version="1.0" encoding="UTF-8"?>
<!DOCTYPE bookself SYSTEM "book.dtd">
<bookself>
	<book>
		<bookname>&bn;从入门到放弃</bookname>
		<author>李某某</author>
		<price>￥45.0</price>
	</book>
	<book>
		<bookname>MySQL从删库到跑路</bookname>
		<author>成莫某</author>
		<price>￥65.9</price>
	</book>
</bookself>